{
  "schema_version": "distill.trace_event.v2",
  "event_id": "event_technique_001",
  "run_id": "run_standard_001",
  "sequence": 1,
  "previous_event_sha256": "1111111111111111111111111111111111111111111111111111111111111111",
  "created_at": "2026-08-28T00:00:01Z",
  "event_type": "technique",
  "payload": {
    "technique_id": "abstraction_level_guard",
    "policy_status": "required",
    "hook_id": "before_accept_split",
    "activation_status": "activated",
    "matched_predicate_ids": [
      "target_context_present"
    ],
    "activation_reason": "The required target context is present, so the abstraction-level guard activates at closure.",
    "inspected_state": [
      "run_frame.target_context",
      "candidate_unit.responsibility"
    ],
    "emitted_output": [
      {
        "field_id": "technique_id",
        "value": {
          "value_kind": "enum",
          "value": "abstraction_level_guard"
        }
      },
      {
        "field_id": "unit_or_layer_id",
        "value": {
          "value_kind": "scalar",
          "value": "machine_grammar"
        }
      },
      {
        "field_id": "selected_level",
        "value": {
          "value_kind": "enum",
          "value": "artifact"
        }
      },
      {
        "field_id": "level_rationale",
        "value": {
          "value_kind": "scalar",
          "value": "The candidate is an independently validated machine artifact family."
        }
      },
      {
        "field_id": "cross_level_confusion",
        "value": {
          "value_kind": "scalar",
          "value": false
        }
      },
      {
        "field_id": "decision",
        "value": {
          "value_kind": "enum",
          "value": "pass"
        }
      }
    ],
    "decision": "pass",
    "readiness_effect": "unchanged"
  },
  "authority_effect": "none"
}
